{
  "$schema": "../../../public/schemas/app.schema.json",
  "id": "yad",
  "name": "YAD — Yet Another Dungeon",
  "version": "0.1.0",
  "schemaVersion": 1,
  "description": "First-person grid-crawler dungeon sample application.",
  "engine": ">=0.115.0",
  "entry": "index.html",
  "levels": [],
  "characters": [],
  "kits": [],
  "code": {
    "module": "./index.ts"
  }
}
